NAICS,NAICS Description,Language Modeling AIIE
811300,Commercial and Industrial Machinery and Equipment (except Automotive and Electronic) Repair and Maintenance,0.5977789754625332
811400,Personal and Household Goods Repair and Maintenance,-0.2543463170991935
812000,Personal and Laundry Services,0.4790500735998663
812100,Personal Care Services,0.7199520113429941
812200,Death Care Services,0.9656830974126993
812300,Drycleaning and Laundry Services,-0.3288067776809115
812900,Other Personal Services,0.6497801317556952
813000,"Religious, Grantmaking, Civic, Professional, and Similar Organizations",2.8123451187706445
813100,Religious Organizations,2.5954525061061595
813200,Grantmaking and Giving Services,3.4447552734288864
813300,Social Advocacy Organizations,2.9584731073343393
813400,Civic and Social Organizations,1.4172410894149745
813900,"Business, Professional, Labor, Political, and Similar Organizations",3.183393971699561
813930,Labor Unions and Similar Labor Organizations,3.607491602209966
99,"Federal, State, and Local Government, excluding State and Local Government Schools and Hospitals and the U.S. Postal Service (OEWS Designation)",2.3003392339088515
999000,"Federal, State, and Local Government, excluding State and Local Government Schools and Hospitals and the U.S. Postal Service (OEWS Designation)",2.326027460658096
999001,"Federal, State, and Local Government, including State and Local Government Schools and Hospitals and the U.S. Postal Service (OEWS Designation)",2.2961224256241737
999100,Federal Executive Branch (OEWS Designation),2.7385037144676447
999101,"Federal Government, including the U.S. Postal Service (OEWS Designation)",2.6320404928830814
999200,"State Government, excluding Schools and Hospitals (OEWS Designation)",2.4955483458701617
999201,"State Government, including Schools and Hospitals (OEWS Designation)",2.4358317322209992
999300,"Local Government, excluding Schools and Hospitals (OEWS Designation)",1.598132648340895
999301,"Local Government, including Schools and Hospitals (OEWS Designation)",1.9297812979187978
