NAICS,NAICS Description,Language Modeling AIIE
811120,"Automotive Body, Paint, Interior, and Glass Repair",-0.531697123114473
811190,Other Automotive Repair and Maintenance,-0.9389753000920429
811200,Electronic and Precision Equipment Repair and Maintenance,0.3038756618017363
811300,Commercial and Industrial Machinery and Equipment (except Automotive and Electronic) Repair and Maintenance,-0.20031349175594243
811400,Personal and Household Goods Repair and Maintenance,-0.5457274249782502
812000,Personal and Laundry Services,-0.19284926998814317
812100,Personal Care Services,-0.14036883067011277
812200,Death Care Services,-0.03507155696293093
812300,Drycleaning and Laundry Services,-0.5843011866913246
812900,Other Personal Services,-0.16348744887974936
813000,"Religious, Grantmaking, Civic, Professional, and Similar Organizations",0.7280066019024716
813100,Religious Organizations,0.6725598149983529
813200,Grantmaking and Giving Services,0.978798075131676
813300,Social Advocacy Organizations,0.8331155700156163
813400,Civic and Social Organizations,0.14680099923229803
813900,"Business, Professional, Labor, Political, and Similar Organizations",0.9013831795069066
813930,Labor Unions and Similar Labor Organizations,1.0284145510991964
99,"Federal, State, and Local Government, excluding State and Local Government Schools and Hospitals and the U.S. Postal Service (OEWS Designation)",0.540948329937306
999000,"Federal, State, and Local Government, excluding State and Local Government Schools and Hospitals and the U.S. Postal Service (OEWS Designation)",0.5201338829834445
999001,"Federal, State, and Local Government, including State and Local Government Schools and Hospitals and the U.S. Postal Service (OEWS Designation)",0.5304556194892213
999100,Federal Executive Branch (OEWS Designation),0.7417599864274762
999101,"Federal Government, including the U.S. Postal Service (OEWS Designation)",0.6689908246887233
999200,"State Government, excluding Schools and Hospitals (OEWS Designation)",0.6285117891150543
999201,"State Government, including Schools and Hospitals (OEWS Designation)",0.6214246050993889
999300,"Local Government, excluding Schools and Hospitals (OEWS Designation)",0.2195737970466912
999301,"Local Government, including Schools and Hospitals (OEWS Designation)",0.3504771117931765
