NAICS,NAICS Description,Language Modeling AIIE
811120,"Automotive Body, Paint, Interior, and Glass Repair",-0.5140642469271498
811190,Other Automotive Repair and Maintenance,-0.9277671508694804
811200,Electronic and Precision Equipment Repair and Maintenance,0.3015803325084416
811300,Commercial and Industrial Machinery and Equipment (except Automotive and Electronic) Repair and Maintenance,-0.18815249453185903
811400,Personal and Household Goods Repair and Maintenance,-0.5501243974020827
812000,Personal and Laundry Services,-0.21016777272180753
812100,Personal Care Services,-0.13340101320792483
812200,Death Care Services,-0.04117595641225607
812300,Drycleaning and Laundry Services,-0.583762000970537
812900,Other Personal Services,-0.17695440595901438
813000,"Religious, Grantmaking, Civic, Professional, and Similar Organizations",0.739954192566312
813100,Religious Organizations,0.6449349752742702
813200,Grantmaking and Giving Services,1.0020735035383075
813300,Social Advocacy Organizations,0.8058081701865867
813400,Civic and Social Organizations,0.1743807020561706
813900,"Business, Professional, Labor, Political, and Similar Organizations",0.8906126596094973
813930,Labor Unions and Similar Labor Organizations,1.066536726233055
99,"Federal, State, and Local Government, excluding State and Local Government Schools and Hospitals and the U.S. Postal Service (OEWS Designation)",0.5423398509186308
999000,"Federal, State, and Local Government, excluding State and Local Government Schools and Hospitals and the U.S. Postal Service (OEWS Designation)",0.5423398509186308
999001,"Federal, State, and Local Government, including State and Local Government Schools and Hospitals and the U.S. Postal Service (OEWS Designation)",0.5239001730815918
999100,Federal Executive Branch (OEWS Designation),0.7192156073749388
999101,"Federal Government, including the U.S. Postal Service (OEWS Designation)",0.6737519196959718
999200,"State Government, excluding Schools and Hospitals (OEWS Designation)",0.6302731473454684
999201,"State Government, including Schools and Hospitals (OEWS Designation)",0.605051141234686
999300,"Local Government, excluding Schools and Hospitals (OEWS Designation)",0.23228871259288306
999301,"Local Government, including Schools and Hospitals (OEWS Designation)",0.37164291065790717
