NAICS,NAICS Description,Language Modeling AIIE
811300,Commercial and Industrial Machinery and Equipment (except Automotive and Electronic) Repair and Maintenance,0.3874908200689571
811400,Personal and Household Goods Repair and Maintenance,-0.2777246649572394
812000,Personal and Laundry Services,0.3886357082887623
812100,Personal Care Services,0.5671012145454626
812200,Death Care Services,0.8452623787959846
812300,Drycleaning and Laundry Services,-0.35189018886590745
812900,Other Personal Services,0.3992167499816447
813000,"Religious, Grantmaking, Civic, Professional, and Similar Organizations",2.4160954034583333
813100,Religious Organizations,2.198399515199307
813200,Grantmaking and Giving Services,2.98369319972658
813300,Social Advocacy Organizations,2.547983159468429
813400,Civic and Social Organizations,1.203638459949915
813900,"Business, Professional, Labor, Political, and Similar Organizations",2.6620120544464076
813930,Labor Unions and Similar Labor Organizations,3.110244584222611
99,"Federal, State, and Local Government, excluding State and Local Government Schools and Hospitals and the U.S. Postal Service (OEWS Designation)",1.9570446733669489
999000,"Federal, State, and Local Government, excluding State and Local Government Schools and Hospitals and the U.S. Postal Service (OEWS Designation)",1.9307432914365539
999001,"Federal, State, and Local Government, including State and Local Government Schools and Hospitals and the U.S. Postal Service (OEWS Designation)",1.9389622938928317
999100,Federal Executive Branch (OEWS Designation),2.3364026592684373
999101,"Federal Government, including the U.S. Postal Service (OEWS Designation)",2.2387322560288623
999200,"State Government, excluding Schools and Hospitals (OEWS Designation)",2.178035473681398
999201,"State Government, including Schools and Hospitals (OEWS Designation)",2.1181384057936823
999300,"Local Government, excluding Schools and Hospitals (OEWS Designation)",1.326632441473966
999301,"Local Government, including Schools and Hospitals (OEWS Designation)",1.618299788202944
