NAICS,NAICS Description,Language Modeling AIIE
811300,Commercial and Industrial Machinery and Equipment (except Automotive and Electronic) Repair and Maintenance,0.25732138269267935
811400,Personal and Household Goods Repair and Maintenance,-0.3288116025841643
812000,Personal and Laundry Services,0.26408681672375156
812100,Personal Care Services,0.38916930278867395
812200,Death Care Services,0.6324696251918305
812300,Drycleaning and Laundry Services,-0.3747799730973171
812900,Other Personal Services,0.3195270235911255
813000,"Religious, Grantmaking, Civic, Professional, and Similar Organizations",2.0255429869651116
813100,Religious Organizations,1.8549694158078192
813200,Grantmaking and Giving Services,2.499919384217831
813300,Social Advocacy Organizations,2.1489081427533554
813400,Civic and Social Organizations,0.9706728564731869
813900,"Business, Professional, Labor, Political, and Similar Organizations",2.312141127048722
813930,Labor Unions and Similar Labor Organizations,2.6262096557214525
99,"Federal, State, and Local Government, excluding State and Local Government Schools and Hospitals and the U.S. Postal Service (OEWS Designation)",1.6402557856010698
999000,"Federal, State, and Local Government, excluding State and Local Government Schools and Hospitals and the U.S. Postal Service (OEWS Designation)",1.6715994325649124
999001,"Federal, State, and Local Government, including State and Local Government Schools and Hospitals and the U.S. Postal Service (OEWS Designation)",1.6430484831113688
999100,Federal Executive Branch (OEWS Designation),1.9877116739451246
999101,"Federal Government, including the U.S. Postal Service (OEWS Designation)",1.8937208116547362
999200,"State Government, excluding Schools and Hospitals (OEWS Designation)",1.7963146729073074
999201,"State Government, including Schools and Hospitals (OEWS Designation)",1.7283804388756312
999300,"Local Government, excluding Schools and Hospitals (OEWS Designation)",1.075760874439285
999301,"Local Government, including Schools and Hospitals (OEWS Designation)",1.3433859144034743
